{
  "schemaVersion": 1,
  "productKey": "agent-builder",
  "prototypeKey": "prototype-library",
  "title": "Mission Surface Prototype Library",
  "description": "A mixed-mode collection of stakeholder-ready prototypes discovered by Mission Surface.",
  "status": "draft",
  "formFactor": "mobile",
  "demoPath": "/demo",
  "entryRoute": "/#/prototypes/mobile-sample",
  "pages": [
    "/#/prototypes/mobile-sample"
  ],
  "createdAt": "2026-08-15",
  "updatedAt": "2026-08-22",
  "catalogueId": "agent-builder-prototype-catalogue",
  "prototypes": [
    {
      "prototypeKey": "mobile-sample",
      "isSample": true,
      "deliveryMode": "live",
      "formFactor": "mobile",
      "manifestPath": "/prototypes/mobile-sample/prototype.json"
    },
    {
      "prototypeKey": "laptop-sample",
      "isSample": true,
      "deliveryMode": "screenshots",
      "formFactor": "laptop",
      "manifestPath": "/prototypes/laptop-sample/prototype.json"
    },
    {
      "prototypeKey": "agent-builder-self-improvement",
      "isSample": false,
      "deliveryMode": "live",
      "formFactor": "laptop",
      "manifestPath": "/prototypes/agent-builder-self-improvement/prototype.json"
    }
  ]
}
